{
  "schema_version": "1.0.0",
  "metadata": {
    "name": "OSH Park (2-layer)",
    "version": "1.0.0",
    "organization": "OSH Park",
    "process_notes": "Standard-process defaults for OSH Park's 2-layer prototype service (process tier: 2-layer, 1oz copper, 1.6 mm ENIG). Numbers are published standard-process minimums (min trace/space 6 mil / 0.152 mm, min drill 10 mil / 0.254 mm, min annular ring 4 mil / 0.1016 mm) and MUST be confirmed against OSH Park's current design rules before relied upon. high_speed_si checks are disabled because the fixed-stackup 2-layer service does not offer a controlled-impedance option."
  },
  "extends": "default",
  "disabled_categories": ["high_speed_si"],
  "overrides": {
    "min_trace_width":  { "limits": { "recommended_min": 0.1778, "absolute_min": 0.1524 } },
    "min_trace_spacing":{ "limits": { "recommended_min": 0.1778, "absolute_min": 0.1524 } },
    "min_drill_size":   { "limits": { "recommended_min": 0.3048, "absolute_min": 0.254 } },
    "min_annular_ring": { "limits": { "recommended_min": 0.127, "absolute_min": 0.1016 } },
    "drill_aspect_ratio": { "limits": { "recommended_max": 6.0, "absolute_max": 8.0 } },
    "via_to_copper_clearance": { "limits": { "recommended_min": 0.1778, "absolute_min": 0.1524 } }
  }
}
